{
  "cases": [
    {
      "conflictLabel": "TP",
      "duplicateObservation": {
        "compressed": null,
        "evidenceAttachedToExpectedTarget": null,
        "measured": false,
        "noNewActiveDerived": null
      },
      "expectedOperation": "SUPERSEDE",
      "id": "op-zh-supersede-tp",
      "language": "zh",
      "newActiveDerivedCount": 1,
      "observedOperation": "SUPERSEDE",
      "observedTargetAliases": [
        "old"
      ],
      "rawFirstPass": true,
      "receiptStatus": "completed",
      "role": "conformance",
      "scenario": "nominal"
    },
    {
      "conflictLabel": "FN",
      "duplicateObservation": {
        "compressed": null,
        "evidenceAttachedToExpectedTarget": null,
        "measured": false,
        "noNewActiveDerived": null
      },
      "expectedOperation": "SUPERSEDE",
      "id": "op-zh-supersede-fn",
      "language": "zh",
      "newActiveDerivedCount": 1,
      "observedOperation": "ADD",
      "observedTargetAliases": [],
      "rawFirstPass": true,
      "receiptStatus": "completed",
      "role": "metric_sentinel",
      "scenario": "nominal"
    },
    {
      "conflictLabel": "TN",
      "duplicateObservation": {
        "compressed": null,
        "evidenceAttachedToExpectedTarget": null,
        "measured": false,
        "noNewActiveDerived": null
      },
      "expectedOperation": "ADD",
      "id": "op-zh-add-tn",
      "language": "zh",
      "newActiveDerivedCount": 1,
      "observedOperation": "ADD",
      "observedTargetAliases": [],
      "rawFirstPass": true,
      "receiptStatus": "completed",
      "role": "conformance",
      "scenario": "nominal"
    },
    {
      "conflictLabel": "TN",
      "duplicateObservation": {
        "compressed": true,
        "evidenceAttachedToExpectedTarget": true,
        "measured": true,
        "noNewActiveDerived": true
      },
      "expectedOperation": "NOOP",
      "id": "op-zh-duplicate-exact",
      "language": "zh",
      "newActiveDerivedCount": 0,
      "observedOperation": "NOOP",
      "observedTargetAliases": [
        "old"
      ],
      "rawFirstPass": true,
      "receiptStatus": "completed",
      "role": "conformance",
      "scenario": "nominal"
    },
    {
      "conflictLabel": "TN",
      "duplicateObservation": {
        "compressed": true,
        "evidenceAttachedToExpectedTarget": true,
        "measured": true,
        "noNewActiveDerived": true
      },
      "expectedOperation": "NOOP",
      "id": "op-zh-duplicate-paraphrase",
      "language": "zh",
      "newActiveDerivedCount": 0,
      "observedOperation": "NOOP",
      "observedTargetAliases": [
        "old"
      ],
      "rawFirstPass": true,
      "receiptStatus": "completed",
      "role": "conformance",
      "scenario": "nominal"
    },
    {
      "conflictLabel": "TN",
      "duplicateObservation": {
        "compressed": null,
        "evidenceAttachedToExpectedTarget": null,
        "measured": false,
        "noNewActiveDerived": null
      },
      "expectedOperation": "CONSOLIDATE",
      "id": "op-zh-consolidate-tn",
      "language": "zh",
      "newActiveDerivedCount": 1,
      "observedOperation": "CONSOLIDATE",
      "observedTargetAliases": [
        "day",
        "month"
      ],
      "rawFirstPass": true,
      "receiptStatus": "completed",
      "role": "conformance",
      "scenario": "nominal"
    },
    {
      "conflictLabel": "FP",
      "duplicateObservation": {
        "compressed": false,
        "evidenceAttachedToExpectedTarget": false,
        "measured": true,
        "noNewActiveDerived": false
      },
      "expectedOperation": "NOOP",
      "id": "op-zh-duplicate-fp",
      "language": "zh",
      "newActiveDerivedCount": 1,
      "observedOperation": "SUPERSEDE",
      "observedTargetAliases": [
        "old"
      ],
      "rawFirstPass": true,
      "receiptStatus": "completed",
      "role": "metric_sentinel",
      "scenario": "nominal"
    },
    {
      "conflictLabel": "TP",
      "duplicateObservation": {
        "compressed": null,
        "evidenceAttachedToExpectedTarget": null,
        "measured": false,
        "noNewActiveDerived": null
      },
      "expectedOperation": "SUPERSEDE",
      "id": "op-en-supersede-tp",
      "language": "en",
      "newActiveDerivedCount": 1,
      "observedOperation": "SUPERSEDE",
      "observedTargetAliases": [
        "old"
      ],
      "rawFirstPass": true,
      "receiptStatus": "completed",
      "role": "conformance",
      "scenario": "nominal"
    },
    {
      "conflictLabel": "FN",
      "duplicateObservation": {
        "compressed": null,
        "evidenceAttachedToExpectedTarget": null,
        "measured": false,
        "noNewActiveDerived": null
      },
      "expectedOperation": "SUPERSEDE",
      "id": "op-en-supersede-fn",
      "language": "en",
      "newActiveDerivedCount": 1,
      "observedOperation": "ADD",
      "observedTargetAliases": [],
      "rawFirstPass": true,
      "receiptStatus": "completed",
      "role": "metric_sentinel",
      "scenario": "nominal"
    },
    {
      "conflictLabel": "TN",
      "duplicateObservation": {
        "compressed": null,
        "evidenceAttachedToExpectedTarget": null,
        "measured": false,
        "noNewActiveDerived": null
      },
      "expectedOperation": "ADD",
      "id": "op-en-add-tn",
      "language": "en",
      "newActiveDerivedCount": 1,
      "observedOperation": "ADD",
      "observedTargetAliases": [],
      "rawFirstPass": true,
      "receiptStatus": "completed",
      "role": "conformance",
      "scenario": "nominal"
    },
    {
      "conflictLabel": "TN",
      "duplicateObservation": {
        "compressed": true,
        "evidenceAttachedToExpectedTarget": true,
        "measured": true,
        "noNewActiveDerived": true
      },
      "expectedOperation": "NOOP",
      "id": "op-en-duplicate-exact",
      "language": "en",
      "newActiveDerivedCount": 0,
      "observedOperation": "NOOP",
      "observedTargetAliases": [
        "old"
      ],
      "rawFirstPass": true,
      "receiptStatus": "completed",
      "role": "conformance",
      "scenario": "nominal"
    },
    {
      "conflictLabel": "TN",
      "duplicateObservation": {
        "compressed": true,
        "evidenceAttachedToExpectedTarget": true,
        "measured": true,
        "noNewActiveDerived": true
      },
      "expectedOperation": "NOOP",
      "id": "op-en-duplicate-paraphrase",
      "language": "en",
      "newActiveDerivedCount": 0,
      "observedOperation": "NOOP",
      "observedTargetAliases": [
        "old"
      ],
      "rawFirstPass": true,
      "receiptStatus": "completed",
      "role": "conformance",
      "scenario": "nominal"
    },
    {
      "conflictLabel": "TN",
      "duplicateObservation": {
        "compressed": null,
        "evidenceAttachedToExpectedTarget": null,
        "measured": false,
        "noNewActiveDerived": null
      },
      "expectedOperation": "CONSOLIDATE",
      "id": "op-en-consolidate-tn",
      "language": "en",
      "newActiveDerivedCount": 1,
      "observedOperation": "CONSOLIDATE",
      "observedTargetAliases": [
        "quiet",
        "window"
      ],
      "rawFirstPass": true,
      "receiptStatus": "completed",
      "role": "conformance",
      "scenario": "nominal"
    },
    {
      "conflictLabel": "FP",
      "duplicateObservation": {
        "compressed": false,
        "evidenceAttachedToExpectedTarget": false,
        "measured": true,
        "noNewActiveDerived": false
      },
      "expectedOperation": "NOOP",
      "id": "op-en-duplicate-fp",
      "language": "en",
      "newActiveDerivedCount": 1,
      "observedOperation": "SUPERSEDE",
      "observedTargetAliases": [
        "old"
      ],
      "rawFirstPass": true,
      "receiptStatus": "completed",
      "role": "metric_sentinel",
      "scenario": "nominal"
    },
    {
      "conflictLabel": null,
      "duplicateObservation": {
        "compressed": null,
        "evidenceAttachedToExpectedTarget": null,
        "measured": false,
        "noNewActiveDerived": null
      },
      "expectedOperation": null,
      "id": "fault-zh-model-extraction",
      "language": "zh",
      "newActiveDerivedCount": 0,
      "observedOperation": null,
      "observedTargetAliases": [],
      "rawFirstPass": true,
      "receiptStatus": "degraded",
      "role": "fault_injection",
      "scenario": "injected_model_failure"
    },
    {
      "conflictLabel": null,
      "duplicateObservation": {
        "compressed": null,
        "evidenceAttachedToExpectedTarget": null,
        "measured": false,
        "noNewActiveDerived": null
      },
      "expectedOperation": null,
      "id": "fault-en-model-reconciliation",
      "language": "en",
      "newActiveDerivedCount": 0,
      "observedOperation": null,
      "observedTargetAliases": [],
      "rawFirstPass": true,
      "receiptStatus": "degraded",
      "role": "fault_injection",
      "scenario": "injected_model_failure"
    },
    {
      "conflictLabel": null,
      "duplicateObservation": {
        "compressed": null,
        "evidenceAttachedToExpectedTarget": null,
        "measured": false,
        "noNewActiveDerived": null
      },
      "expectedOperation": null,
      "id": "fault-zh-invalid-json-extraction",
      "language": "zh",
      "newActiveDerivedCount": 0,
      "observedOperation": null,
      "observedTargetAliases": [],
      "rawFirstPass": true,
      "receiptStatus": "degraded",
      "role": "fault_injection",
      "scenario": "invalid_json"
    },
    {
      "conflictLabel": null,
      "duplicateObservation": {
        "compressed": null,
        "evidenceAttachedToExpectedTarget": null,
        "measured": false,
        "noNewActiveDerived": null
      },
      "expectedOperation": null,
      "id": "fault-en-invalid-json-reconciliation",
      "language": "en",
      "newActiveDerivedCount": 0,